product_id,product_name,category,fit,neckline,pattern,sleeve_style,length,occasion,style_aesthetic,trend,price,base_return_rate
PROD_00758,AW24 Core Fitted Animal Print Outerwear,Outerwear,Fitted,-,Animal Print,Cap,-,Loungewear,Boho,AW24 Core,100.77,0.7008479035308026
PROD_00759,Continuity Relaxed Animal Print Outerwear,Outerwear,Relaxed,-,Animal Print,Puff,-,Holiday,Romantic,Continuity,136.36,0.5845329975688727
PROD_00760,Clearance Fitted Stripe Outerwear,Outerwear,Fitted,-,Stripe,Long,-,Evening,Classic,Clearance,95.21,0.6880761174388852
PROD_00761,AW24 Core Slim Plain Short,Shorts,Slim,-,Plain,Puff,-,Smart Casual,Classic,AW24 Core,33.08,0.4825664583052055
PROD_00762,SS25 Preview Regular Stripe Short,Shorts,Regular,-,Stripe,Long,-,Smart Casual,Boho,SS25 Preview,32.49,0.5292539767621337
PROD_00763,AW24 Trend Regular Polka Dot Short,Shorts,Regular,-,Polka Dot,Standard,-,Loungewear,Boho,AW24 Trend,51.97,0.4466659829823306
PROD_00764,Clearance Fitted Plain Short,Shorts,Fitted,-,Plain,Balloon,-,Evening,Classic,Clearance,48.05,0.512481721144515
PROD_00765,Clearance Fitted Polka Dot Short,Shorts,Fitted,-,Polka Dot,Sleeveless,-,Loungewear,Sporty,Clearance,48.2,0.5665366841550653
PROD_00766,AW24 Core Oversized Floral Short,Shorts,Oversized,-,Floral,Bell,-,Loungewear,Boho,AW24 Core,49.64,0.5354620491211145
PROD_00767,Clearance Oversized Check Short,Shorts,Oversized,-,Check,Puff,-,Loungewear,Boho,Clearance,28.22,0.6026192986414627
PROD_00768,Clearance Slim Plain Short,Shorts,Slim,-,Plain,Cap,-,Work,Contemporary,Clearance,34.01,0.4675412175992788
PROD_00769,SS25 Preview Oversized Polka Dot Short,Shorts,Oversized,-,Polka Dot,Sleeveless,-,Loungewear,Sporty,SS25 Preview,49.32,0.6069315416363501
PROD_00770,AW24 Trend Fitted Animal Print Short,Shorts,Fitted,-,Animal Print,Cap,-,Holiday,Contemporary,AW24 Trend,42.57,0.6459941951293964
PROD_00771,AW24 Trend Relaxed Check Short,Shorts,Relaxed,-,Check,Sleeveless,-,Loungewear,Classic,AW24 Trend,47.32,0.47884998527955613
PROD_00772,AW24 Core Regular Abstract Short,Shorts,Regular,-,Abstract,Bell,-,Casual,Minimalist,AW24 Core,34.45,0.546732811135347
PROD_00773,AW24 Trend Oversized Stripe Short,Shorts,Oversized,-,Stripe,Bell,-,Work,Contemporary,AW24 Trend,30.07,0.5594825951600547
PROD_00774,Continuity Fitted Polka Dot Short,Shorts,Fitted,-,Polka Dot,Balloon,-,Casual,Boho,Continuity,40.07,0.5359136656462968
PROD_00775,AW24 Core Regular Plain Short,Shorts,Regular,-,Plain,Sleeveless,-,Work,Romantic,AW24 Core,38.61,0.3844436484155078
PROD_00776,Clearance Fitted Polka Dot Short,Shorts,Fitted,-,Polka Dot,Cap,-,Work,Minimalist,Clearance,40.52,0.5534104652086564
PROD_00777,Clearance Fitted Stripe Short,Shorts,Fitted,-,Stripe,Standard,-,Loungewear,Boho,Clearance,28.2,0.55856543354288
PROD_00778,AW24 Trend Regular Floral Short,Shorts,Regular,-,Floral,Bell,-,Casual,Romantic,AW24 Trend,45.11,0.5561005982949556
PROD_00779,SS25 Preview Oversized Animal Print Short,Shorts,Oversized,-,Animal Print,Bell,-,Evening,Classic,SS25 Preview,29.27,0.6366286386206522
PROD_00780,SS25 Preview Regular Floral Short,Shorts,Regular,-,Floral,Cap,-,Work,Boho,SS25 Preview,50.92,0.565493253978505
PROD_00781,Continuity Relaxed Floral Short,Shorts,Relaxed,-,Floral,Long,-,Holiday,Romantic,Continuity,35.76,0.3440151596022014
PROD_00782,AW24 Core Fitted Polka Dot Short,Shorts,Fitted,-,Polka Dot,Long,-,Loungewear,Classic,AW24 Core,41.85,0.4983812889481815
PROD_00783,Clearance Relaxed Check Short,Shorts,Relaxed,-,Check,Sleeveless,-,Loungewear,Romantic,Clearance,36.55,0.44548413946474547
PROD_00784,AW24 Core Regular Plain Short,Shorts,Regular,-,Plain,Cap,-,Work,Minimalist,AW24 Core,41.44,0.4297013013934263
PROD_00785,AW24 Core Oversized Stripe Short,Shorts,Oversized,-,Stripe,Bell,-,Loungewear,Boho,AW24 Core,38.09,0.49864625643279353
PROD_00786,Clearance Fitted Polka Dot Short,Shorts,Fitted,-,Polka Dot,Long,-,Work,Romantic,Clearance,28.14,0.556211088262323
PROD_00787,AW24 Trend Oversized Check Short,Shorts,Oversized,-,Check,Standard,-,Work,Sporty,AW24 Trend,49.15,0.517850986845361
PROD_00788,Clearance Relaxed Animal Print Short,Shorts,Relaxed,-,Animal Print,Standard,-,Casual,Contemporary,Clearance,44.96,0.44778789890912907
PROD_00789,AW24 Trend Fitted Plain Short,Shorts,Fitted,-,Plain,Cap,-,Casual,Contemporary,AW24 Trend,34.5,0.6020038164109053
PROD_00790,Continuity Oversized Polka Dot Short,Shorts,Oversized,-,Polka Dot,Standard,-,Smart Casual,Romantic,Continuity,41.65,0.42704914370595143
PROD_00791,Continuity Slim Abstract Short,Shorts,Slim,-,Abstract,Cap,-,Smart Casual,Classic,Continuity,50.61,0.5481708969638585
PROD_00792,AW24 Trend Relaxed Plain Short,Shorts,Relaxed,-,Plain,Standard,-,Casual,Classic,AW24 Trend,30.08,0.4539563248111268
PROD_00793,SS25 Preview Relaxed Animal Print Short,Shorts,Relaxed,-,Animal Print,Standard,-,Holiday,Contemporary,SS25 Preview,37.85,0.566915415553485
PROD_00794,Continuity Oversized Check Short,Shorts,Oversized,-,Check,Puff,-,Loungewear,Minimalist,Continuity,29.18,0.4870700999491062
PROD_00795,Clearance Relaxed Plain Short,Shorts,Relaxed,-,Plain,Puff,-,Loungewear,Classic,Clearance,46.97,0.39910621393463586
PROD_00796,Clearance Slim Abstract Short,Shorts,Slim,-,Abstract,Cap,-,Holiday,Classic,Clearance,35.24,0.5753958833047861
PROD_00797,Clearance Slim Abstract Short,Shorts,Slim,-,Abstract,Long,-,Casual,Boho,Clearance,48.51,0.5484019073964959
PROD_00798,Clearance Slim Stripe Short,Shorts,Slim,-,Stripe,Long,-,Loungewear,Boho,Clearance,34.54,0.5448999017404957
PROD_00799,Continuity Slim Stripe Short,Shorts,Slim,-,Stripe,Long,-,Evening,Minimalist,Continuity,34.05,0.4117501840212373
PROD_00800,AW24 Trend Slim Check Short,Shorts,Slim,-,Check,Sleeveless,-,Holiday,Contemporary,AW24 Trend,41.96,0.6520756451054734
PROD_00801,AW24 Trend Oversized Polka Dot Jumpsuit,Jumpsuits,Oversized,-,Polka Dot,Long,-,Holiday,Boho,AW24 Trend,89.92,0.6133480208744784
PROD_00802,SS25 Preview Relaxed Abstract Jumpsuit,Jumpsuits,Relaxed,-,Abstract,Long,-,Loungewear,Sporty,SS25 Preview,100.66,0.5866028265746515
PROD_00803,AW24 Core Slim Animal Print Jumpsuit,Jumpsuits,Slim,-,Animal Print,Long,-,Holiday,Contemporary,AW24 Core,65.45,0.6423286249300248
PROD_00804,Clearance Slim Plain Jumpsuit,Jumpsuits,Slim,-,Plain,Bell,-,Holiday,Minimalist,Clearance,86.88,0.5729065124829062
PROD_00805,SS25 Preview Fitted Plain Jumpsuit,Jumpsuits,Fitted,-,Plain,Balloon,-,Smart Casual,Sporty,SS25 Preview,75.23,0.7436570218070839
PROD_00806,AW24 Trend Regular Check Jumpsuit,Jumpsuits,Regular,-,Check,Cap,-,Holiday,Contemporary,AW24 Trend,98.47,0.636954116885922
PROD_00807,AW24 Core Regular Floral Jumpsuit,Jumpsuits,Regular,-,Floral,Bell,-,Work,Contemporary,AW24 Core,61.35,0.5347812442906907
PROD_00808,Clearance Regular Abstract Jumpsuit,Jumpsuits,Regular,-,Abstract,Long,-,Holiday,Classic,Clearance,96.65,0.5201847265142383
PROD_00809,AW24 Core Oversized Abstract Jumpsuit,Jumpsuits,Oversized,-,Abstract,Bell,-,Casual,Boho,AW24 Core,78.43,0.5999669738040648
PROD_00810,Continuity Relaxed Plain Jumpsuit,Jumpsuits,Relaxed,-,Plain,Sleeveless,-,Loungewear,Romantic,Continuity,96.5,0.43016991660064247
PROD_00811,AW24 Trend Relaxed Stripe Jumpsuit,Jumpsuits,Relaxed,-,Stripe,Sleeveless,-,Loungewear,Sporty,AW24 Trend,80.22,0.5213231223259126
PROD_00812,SS25 Preview Slim Stripe Jumpsuit,Jumpsuits,Slim,-,Stripe,Bell,-,Casual,Contemporary,SS25 Preview,87.08,0.6985072909142696
PROD_00813,SS25 Preview Oversized Check Jumpsuit,Jumpsuits,Oversized,-,Check,Balloon,-,Holiday,Sporty,SS25 Preview,68.26,0.7418360641395217
PROD_00814,SS25 Preview Fitted Floral Jumpsuit,Jumpsuits,Fitted,-,Floral,Bell,-,Holiday,Boho,SS25 Preview,94.84,0.7707831451826622
PROD_00815,AW24 Trend Oversized Floral Jumpsuit,Jumpsuits,Oversized,-,Floral,Standard,-,Work,Contemporary,AW24 Trend,95.18,0.6355870814198961
PROD_00816,SS25 Preview Oversized Stripe Jumpsuit,Jumpsuits,Oversized,-,Stripe,Long,-,Work,Contemporary,SS25 Preview,66.56,0.6212017738951656
PROD_00817,Continuity Oversized Check Jumpsuit,Jumpsuits,Oversized,-,Check,Puff,-,Work,Boho,Continuity,86.26,0.5865765240265368
PROD_00818,AW24 Core Fitted Plain Jumpsuit,Jumpsuits,Fitted,-,Plain,Sleeveless,-,Loungewear,Romantic,AW24 Core,76.74,0.6139374800542775
PROD_00819,AW24 Trend Relaxed Polka Dot Jumpsuit,Jumpsuits,Relaxed,-,Polka Dot,Long,-,Smart Casual,Romantic,AW24 Trend,89.46,0.5806866577339836
PROD_00820,AW24 Core Relaxed Abstract Jumpsuit,Jumpsuits,Relaxed,-,Abstract,Cap,-,Casual,Sporty,AW24 Core,82.44,0.4985402484290874
PROD_00821,Clearance Slim Polka Dot Jumpsuit,Jumpsuits,Slim,-,Polka Dot,Bell,-,Loungewear,Classic,Clearance,100.0,0.6756356054743634
PROD_00822,AW24 Core Fitted Check Jumpsuit,Jumpsuits,Fitted,-,Check,Long,-,Holiday,Contemporary,AW24 Core,105.13,0.6294597052763758
PROD_00823,AW24 Trend Fitted Stripe Jumpsuit,Jumpsuits,Fitted,-,Stripe,Bell,-,Holiday,Minimalist,AW24 Trend,80.44,0.6667668437194298
PROD_00824,SS25 Preview Relaxed Check Jumpsuit,Jumpsuits,Relaxed,-,Check,Sleeveless,-,Holiday,Sporty,SS25 Preview,105.21,0.659859691056897
PROD_00825,Continuity Regular Check Jumpsuit,Jumpsuits,Regular,-,Check,Bell,-,Holiday,Classic,Continuity,103.31,0.5385712768824681
PROD_00826,Clearance Relaxed Animal Print Jumpsuit,Jumpsuits,Relaxed,-,Animal Print,Standard,-,Loungewear,Contemporary,Clearance,103.61,0.5288773266956234
PROD_00827,AW24 Trend Regular Polka Dot Jumpsuit,Jumpsuits,Regular,-,Polka Dot,Bell,-,Smart Casual,Minimalist,AW24 Trend,68.59,0.5820619906550227
PROD_00828,Continuity Regular Animal Print Jumpsuit,Jumpsuits,Regular,-,Animal Print,Bell,-,Loungewear,Contemporary,Continuity,80.82,0.5239369836342047
PROD_00829,AW24 Core Relaxed Plain Jumpsuit,Jumpsuits,Relaxed,-,Plain,Sleeveless,-,Evening,Contemporary,AW24 Core,75.85,0.4551192004604467
PROD_00830,AW24 Trend Relaxed Stripe Jumpsuit,Jumpsuits,Relaxed,-,Stripe,Sleeveless,-,Casual,Sporty,AW24 Trend,74.61,0.5234978486071643
PROD_00831,Continuity Fitted Polka Dot Sweatshirt,Sweatshirts,Fitted,-,Polka Dot,Balloon,-,Evening,Minimalist,Continuity,53.08,0.4472283814542002
PROD_00832,Clearance Slim Plain Sweatshirt,Sweatshirts,Slim,-,Plain,Cap,-,Work,Classic,Clearance,63.13,0.4046718761235912
PROD_00833,Clearance Relaxed Polka Dot Sweatshirt,Sweatshirts,Relaxed,-,Polka Dot,Cap,-,Work,Romantic,Clearance,63.47,0.39935099713933186
PROD_00834,SS25 Preview Fitted Floral Sweatshirt,Sweatshirts,Fitted,-,Floral,Puff,-,Loungewear,Minimalist,SS25 Preview,63.07,0.553200070211768
PROD_00835,SS25 Preview Fitted Abstract Sweatshirt,Sweatshirts,Fitted,-,Abstract,Long,-,Casual,Romantic,SS25 Preview,42.8,0.5151980182474052
PROD_00836,SS25 Preview Oversized Floral Sweatshirt,Sweatshirts,Oversized,-,Floral,Bell,-,Evening,Boho,SS25 Preview,65.15,0.5045627037036159
PROD_00837,Clearance Oversized Polka Dot Sweatshirt,Sweatshirts,Oversized,-,Polka Dot,Puff,-,Holiday,Classic,Clearance,40.59,0.42463482472423025
PROD_00838,Clearance Regular Check Sweatshirt,Sweatshirts,Regular,-,Check,Sleeveless,-,Smart Casual,Classic,Clearance,66.84,0.37317095352063556
PROD_00839,SS25 Preview Relaxed Floral Sweatshirt,Sweatshirts,Relaxed,-,Floral,Sleeveless,-,Smart Casual,Contemporary,SS25 Preview,46.86,0.4533783284747288
PROD_00840,AW24 Trend Fitted Abstract Sweatshirt,Sweatshirts,Fitted,-,Abstract,Long,-,Casual,Sporty,AW24 Trend,55.91,0.5255295825328181
PROD_00841,Continuity Oversized Polka Dot Sweatshirt,Sweatshirts,Oversized,-,Polka Dot,Balloon,-,Loungewear,Classic,Continuity,46.2,0.40554359784406613
PROD_00842,Continuity Oversized Check Sweatshirt,Sweatshirts,Oversized,-,Check,Sleeveless,-,Holiday,Contemporary,Continuity,48.71,0.42644029871943984
PROD_00843,Clearance Slim Floral Sweatshirt,Sweatshirts,Slim,-,Floral,Standard,-,Smart Casual,Romantic,Clearance,39.03,0.4794131653976238
PROD_00844,Clearance Regular Floral Sweatshirt,Sweatshirts,Regular,-,Floral,Cap,-,Holiday,Classic,Clearance,50.11,0.3772657129894148
PROD_00845,Clearance Regular Plain Sweatshirt,Sweatshirts,Regular,-,Plain,Sleeveless,-,Work,Contemporary,Clearance,40.9,0.3543484428583015
PROD_00846,SS25 Preview Oversized Animal Print Sweatshirt,Sweatshirts,Oversized,-,Animal Print,Bell,-,Loungewear,Classic,SS25 Preview,45.69,0.5890131373726107
PROD_00847,Continuity Slim Floral Sweatshirt,Sweatshirts,Slim,-,Floral,Puff,-,Holiday,Minimalist,Continuity,65.01,0.4377037814882011
PROD_00848,AW24 Trend Regular Floral Sweatshirt,Sweatshirts,Regular,-,Floral,Long,-,Evening,Romantic,AW24 Trend,62.95,0.40618769562415136
PROD_00849,Clearance Fitted Polka Dot Sweatshirt,Sweatshirts,Fitted,-,Polka Dot,Long,-,Smart Casual,Romantic,Clearance,50.23,0.4761860312215006
PROD_00850,Continuity Relaxed Floral Sweatshirt,Sweatshirts,Relaxed,-,Floral,Cap,-,Loungewear,Boho,Continuity,48.23,0.33088585390335656
PROD_00851,Continuity Fitted Animal Print Sweatshirt,Sweatshirts,Fitted,-,Animal Print,Standard,-,Smart Casual,Minimalist,Continuity,63.1,0.4571212917751517
PROD_00852,Clearance Regular Plain Sweatshirt,Sweatshirts,Regular,-,Plain,Standard,-,Smart Casual,Romantic,Clearance,48.49,0.3178955909812508
PROD_00853,AW24 Trend Oversized Polka Dot Sweatshirt,Sweatshirts,Oversized,-,Polka Dot,Sleeveless,-,Holiday,Classic,AW24 Trend,65.49,0.4659346010172823
PROD_00854,Clearance Oversized Animal Print Sweatshirt,Sweatshirts,Oversized,-,Animal Print,Bell,-,Casual,Romantic,Clearance,56.49,0.5429921763145664
PROD_00855,Clearance Slim Plain Sweatshirt,Sweatshirts,Slim,-,Plain,Puff,-,Loungewear,Contemporary,Clearance,68.31,0.4561466205323652
PROD_00856,Continuity Fitted Polka Dot Sweatshirt,Sweatshirts,Fitted,-,Polka Dot,Standard,-,Loungewear,Sporty,Continuity,46.16,0.3598546851412943
PROD_00857,Clearance Fitted Check Sweatshirt,Sweatshirts,Fitted,-,Check,Balloon,-,Casual,Sporty,Clearance,65.68,0.5508900006251584
PROD_00858,SS25 Preview Oversized Floral Sweatshirt,Sweatshirts,Oversized,-,Floral,Long,-,Evening,Minimalist,SS25 Preview,52.2,0.5157029028330579
PROD_00859,AW24 Core Fitted Polka Dot Sweatshirt,Sweatshirts,Fitted,-,Polka Dot,Cap,-,Loungewear,Romantic,AW24 Core,52.95,0.41893399022918676
PROD_00860,AW24 Core Oversized Floral Sweatshirt,Sweatshirts,Oversized,-,Floral,Balloon,-,Evening,Contemporary,AW24 Core,48.11,0.42307345902070537
PROD_00861,AW24 Trend Relaxed Animal Print Sweatshirt,Sweatshirts,Relaxed,-,Animal Print,Bell,-,Evening,Boho,AW24 Trend,40.99,0.4872267556837506
PROD_00862,Clearance Slim Abstract Sweatshirt,Sweatshirts,Slim,-,Abstract,Cap,-,Casual,Romantic,Clearance,52.61,0.5227581217480702
PROD_00863,AW24 Trend Slim Animal Print Sweatshirt,Sweatshirts,Slim,-,Animal Print,Standard,-,Evening,Sporty,AW24 Trend,41.46,0.5396063931100595
PROD_00864,Continuity Relaxed Check Sweatshirt,Sweatshirts,Relaxed,-,Check,Balloon,-,Casual,Contemporary,Continuity,41.46,0.3237359078357279
PROD_00865,Clearance Fitted Stripe Sweatshirt,Sweatshirts,Fitted,-,Stripe,Balloon,-,Holiday,Minimalist,Clearance,65.14,0.5461543722881109
PROD_00866,AW24 Trend Relaxed Animal Print Sweatshirt,Sweatshirts,Relaxed,-,Animal Print,Balloon,-,Loungewear,Minimalist,AW24 Trend,45.88,0.465963275435646
PROD_00867,AW24 Trend Oversized Animal Print Sweatshirt,Sweatshirts,Oversized,-,Animal Print,Long,-,Holiday,Minimalist,AW24 Trend,49.87,0.5333455105249852
PROD_00868,SS25 Preview Relaxed Animal Print Sweatshirt,Sweatshirts,Relaxed,-,Animal Print,Bell,-,Evening,Boho,SS25 Preview,57.08,0.4560984431687375
PROD_00869,AW24 Trend Fitted Stripe Sweatshirt,Sweatshirts,Fitted,-,Stripe,Long,-,Loungewear,Minimalist,AW24 Trend,38.63,0.5243774120344816
PROD_00870,AW24 Trend Slim Abstract Sweatshirt,Sweatshirts,Slim,-,Abstract,Sleeveless,-,Evening,Sporty,AW24 Trend,69.47,0.5038124843253999
PROD_00871,Clearance Slim Floral Sweatshirt,Sweatshirts,Slim,-,Floral,Bell,-,Evening,Boho,Clearance,42.24,0.4571085966857163
PROD_00872,AW24 Trend Fitted Abstract Sweatshirt,Sweatshirts,Fitted,-,Abstract,Cap,-,Loungewear,Classic,AW24 Trend,66.94,0.5470187215799804
PROD_00873,Continuity Oversized Abstract Sweatshirt,Sweatshirts,Oversized,-,Abstract,Standard,-,Casual,Contemporary,Continuity,71.32,0.3777109817693926
PROD_00874,AW24 Trend Fitted Check Sweatshirt,Sweatshirts,Fitted,-,Check,Standard,-,Casual,Boho,AW24 Trend,40.94,0.5379171699537995
PROD_00875,Continuity Relaxed Plain Sweatshirt,Sweatshirts,Relaxed,-,Plain,Bell,-,Casual,Sporty,Continuity,51.96,0.31928321316819763
PROD_00876,Clearance Oversized Animal Print Sweatshirt,Sweatshirts,Oversized,-,Animal Print,Cap,-,Holiday,Boho,Clearance,56.91,0.45874025338454827
PROD_00877,Continuity Slim Polka Dot Sweatshirt,Sweatshirts,Slim,-,Polka Dot,Long,-,Smart Casual,Sporty,Continuity,41.35,0.3504307591820865
PROD_00878,SS25 Preview Oversized Plain Sweatshirt,Sweatshirts,Oversized,-,Plain,Sleeveless,-,Loungewear,Romantic,SS25 Preview,53.34,0.4101428343079177
PROD_00879,Clearance Regular Plain Sweatshirt,Sweatshirts,Regular,-,Plain,Long,-,Holiday,Romantic,Clearance,57.39,0.35368634222265927
PROD_00880,SS25 Preview Regular Animal Print Sweatshirt,Sweatshirts,Regular,-,Animal Print,Sleeveless,-,Loungewear,Classic,SS25 Preview,47.97,0.549920729894344
PROD_00881,SS25 Preview Regular Abstract Sweatshirt,Sweatshirts,Regular,-,Abstract,Standard,-,Smart Casual,Classic,SS25 Preview,43.77,0.43804550647600554
PROD_00882,Clearance Oversized Stripe Sweatshirt,Sweatshirts,Oversized,-,Stripe,Cap,-,Evening,Minimalist,Clearance,47.91,0.38640635882653357
PROD_00883,AW24 Core Regular Animal Print Sweatshirt,Sweatshirts,Regular,-,Animal Print,Standard,-,Loungewear,Sporty,AW24 Core,68.39,0.4292840045273527
PROD_00884,Clearance Slim Animal Print Sweatshirt,Sweatshirts,Slim,-,Animal Print,Balloon,-,Loungewear,Romantic,Clearance,46.17,0.5875087169707681
PROD_00885,Clearance Relaxed Stripe Sweatshirt,Sweatshirts,Relaxed,-,Stripe,Long,-,Work,Contemporary,Clearance,49.33,0.3681297545614092
PROD_00886,SS25 Preview Regular Check Sweatshirt,Sweatshirts,Regular,-,Check,Puff,-,Holiday,Classic,SS25 Preview,67.21,0.4412840544516885
PROD_00887,AW24 Core Regular Check Sweatshirt,Sweatshirts,Regular,-,Check,Bell,-,Casual,Romantic,AW24 Core,43.94,0.41361056346436187
PROD_00888,SS25 Preview Fitted Stripe Sweatshirt,Sweatshirts,Fitted,-,Stripe,Balloon,-,Casual,Romantic,SS25 Preview,47.98,0.5529831257513003
PROD_00889,Continuity Fitted Polka Dot Sweatshirt,Sweatshirts,Fitted,-,Polka Dot,Long,-,Holiday,Boho,Continuity,53.46,0.41367945687101976
PROD_00890,Continuity Oversized Animal Print Sweatshirt,Sweatshirts,Oversized,-,Animal Print,Puff,-,Smart Casual,Boho,Continuity,40.31,0.4789279945106385
PROD_00891,AW24 Core Oversized Animal Print Sweatshirt,Sweatshirts,Oversized,-,Animal Print,Long,-,Casual,Minimalist,AW24 Core,54.4,0.42550152661362467
PROD_00892,AW24 Trend Relaxed Plain Sweatshirt,Sweatshirts,Relaxed,-,Plain,Puff,-,Loungewear,Contemporary,AW24 Trend,48.93,0.370313355474832
PROD_00893,AW24 Core Relaxed Check Sweatshirt,Sweatshirts,Relaxed,-,Check,Balloon,-,Holiday,Romantic,AW24 Core,67.37,0.41292402490975677
PROD_00894,SS25 Preview Relaxed Floral Sweatshirt,Sweatshirts,Relaxed,-,Floral,Balloon,-,Casual,Minimalist,SS25 Preview,65.07,0.5038719301977863
PROD_00895,SS25 Preview Slim Animal Print Sweatshirt,Sweatshirts,Slim,-,Animal Print,Sleeveless,-,Evening,Boho,SS25 Preview,56.67,0.6150580197306599
PROD_00896,AW24 Trend Regular Animal Print Sweatshirt,Sweatshirts,Regular,-,Animal Print,Balloon,-,Smart Casual,Sporty,AW24 Trend,48.52,0.5225888226426815
PROD_00897,AW24 Trend Oversized Abstract Sweatshirt,Sweatshirts,Oversized,-,Abstract,Sleeveless,-,Smart Casual,Sporty,AW24 Trend,48.96,0.48984787621092146
PROD_00898,Clearance Relaxed Floral Sweatshirt,Sweatshirts,Relaxed,-,Floral,Sleeveless,-,Smart Casual,Contemporary,Clearance,47.92,0.3767387335447926
PROD_00899,AW24 Core Relaxed Floral Sweatshirt,Sweatshirts,Relaxed,-,Floral,Long,-,Casual,Classic,AW24 Core,48.82,0.3761611442254447
PROD_00900,Continuity Oversized Animal Print Sweatshirt,Sweatshirts,Oversized,-,Animal Print,Standard,-,Holiday,Classic,Continuity,55.88,0.359804453811094
PROD_00901,SS25 Preview Relaxed Animal Print Sweatshirt,Sweatshirts,Relaxed,-,Animal Print,Balloon,-,Evening,Romantic,SS25 Preview,42.15,0.45570990784451765
PROD_00902,Continuity Oversized Floral Sweatshirt,Sweatshirts,Oversized,-,Floral,Long,-,Holiday,Boho,Continuity,53.82,0.32193893891962466
PROD_00903,Clearance Regular Polka Dot Sweatshirt,Sweatshirts,Regular,-,Polka Dot,Bell,-,Smart Casual,Classic,Clearance,64.89,0.3933250932309028
PROD_00904,SS25 Preview Oversized Check Sweatshirt,Sweatshirts,Oversized,-,Check,Bell,-,Casual,Romantic,SS25 Preview,52.57,0.5539474653884113
PROD_00905,AW24 Core Oversized Polka Dot Sweatshirt,Sweatshirts,Oversized,-,Polka Dot,Cap,-,Smart Casual,Minimalist,AW24 Core,48.94,0.393370420757563
PROD_00906,AW24 Core Fitted Check Sweatshirt,Sweatshirts,Fitted,-,Check,Balloon,-,Loungewear,Classic,AW24 Core,40.22,0.537399508729401
PROD_00907,SS25 Preview Regular Check Sweatshirt,Sweatshirts,Regular,-,Check,Bell,-,Casual,Boho,SS25 Preview,64.75,0.43128216495106064
PROD_00908,SS25 Preview Fitted Polka Dot Sweatshirt,Sweatshirts,Fitted,-,Polka Dot,Balloon,-,Smart Casual,Romantic,SS25 Preview,42.82,0.567714637598905
PROD_00909,SS25 Preview Regular Stripe Sweatshirt,Sweatshirts,Regular,-,Stripe,Puff,-,Holiday,Boho,SS25 Preview,69.27,0.4235565934594501
PROD_00910,SS25 Preview Regular Check Sweatshirt,Sweatshirts,Regular,-,Check,Puff,-,Smart Casual,Minimalist,SS25 Preview,61.92,0.5159502975624899
PROD_00911,AW24 Trend Relaxed Polka Dot Pyjama,Pyjamas,Relaxed,-,Polka Dot,Puff,-,Work,Minimalist,AW24 Trend,45.55,0.32822252303373267
PROD_00912,AW24 Core Fitted Floral Pyjama,Pyjamas,Fitted,-,Floral,Bell,-,Loungewear,Contemporary,AW24 Core,57.58,0.4575244535283959
PROD_00913,Continuity Relaxed Polka Dot Pyjama,Pyjamas,Relaxed,-,Polka Dot,Sleeveless,-,Holiday,Minimalist,Continuity,53.4,0.19152690457858346
PROD_00914,Continuity Regular Floral Pyjama,Pyjamas,Regular,-,Floral,Long,-,Loungewear,Contemporary,Continuity,37.27,0.18972426661670172
PROD_00915,Clearance Slim Floral Pyjama,Pyjamas,Slim,-,Floral,Puff,-,Evening,Contemporary,Clearance,42.44,0.4276093034164577
PROD_00916,SS25 Preview Fitted Abstract Pyjama,Pyjamas,Fitted,-,Abstract,Balloon,-,Evening,Boho,SS25 Preview,33.9,0.5631544407106519
PROD_00917,AW24 Core Fitted Polka Dot Pyjama,Pyjamas,Fitted,-,Polka Dot,Bell,-,Casual,Minimalist,AW24 Core,56.3,0.40115256408094935
PROD_00918,AW24 Core Regular Plain Pyjama,Pyjamas,Regular,-,Plain,Sleeveless,-,Work,Minimalist,AW24 Core,35.73,0.29041136604795054
PROD_00919,SS25 Preview Oversized Abstract Pyjama,Pyjamas,Oversized,-,Abstract,Balloon,-,Work,Boho,SS25 Preview,48.22,0.45666377000964564
PROD_00920,AW24 Core Fitted Animal Print Pyjama,Pyjamas,Fitted,-,Animal Print,Long,-,Work,Boho,AW24 Core,57.64,0.3759394884771402
PROD_00921,AW24 Trend Oversized Plain Pyjama,Pyjamas,Oversized,-,Plain,Balloon,-,Loungewear,Romantic,AW24 Trend,36.01,0.41147493287276604
PROD_00922,AW24 Trend Fitted Animal Print Pyjama,Pyjamas,Fitted,-,Animal Print,Cap,-,Loungewear,Romantic,AW24 Trend,33.81,0.4421155461260985
PROD_00923,Continuity Relaxed Stripe Pyjama,Pyjamas,Relaxed,-,Stripe,Balloon,-,Loungewear,Romantic,Continuity,36.73,0.27094436640366315
PROD_00924,Continuity Oversized Plain Pyjama,Pyjamas,Oversized,-,Plain,Puff,-,Holiday,Boho,Continuity,43.62,0.25162849285443556
PROD_00925,Continuity Regular Polka Dot Pyjama,Pyjamas,Regular,-,Polka Dot,Sleeveless,-,Loungewear,Boho,Continuity,33.44,0.2499011044213568
PROD_00926,AW24 Trend Fitted Animal Print Pyjama,Pyjamas,Fitted,-,Animal Print,Puff,-,Casual,Classic,AW24 Trend,56.65,0.47267586174005155
PROD_00927,SS25 Preview Relaxed Floral Pyjama,Pyjamas,Relaxed,-,Floral,Balloon,-,Work,Sporty,SS25 Preview,52.59,0.420841010726857
PROD_00928,Continuity Relaxed Animal Print Pyjama,Pyjamas,Relaxed,-,Animal Print,Cap,-,Evening,Boho,Continuity,40.33,0.2119401245618216
PROD_00929,Continuity Relaxed Abstract Pyjama,Pyjamas,Relaxed,-,Abstract,Bell,-,Holiday,Minimalist,Continuity,38.93,0.27279587353429086
PROD_00930,AW24 Trend Regular Floral Pyjama,Pyjamas,Regular,-,Floral,Long,-,Casual,Contemporary,AW24 Trend,48.62,0.36095866950537775
PROD_00931,AW24 Trend Relaxed Abstract Pyjama,Pyjamas,Relaxed,-,Abstract,Cap,-,Loungewear,Classic,AW24 Trend,56.04,0.2971906717316446
PROD_00932,Continuity Regular Check Pyjama,Pyjamas,Regular,-,Check,Standard,-,Casual,Classic,Continuity,33.6,0.2857766658176223
PROD_00933,AW24 Core Fitted Plain Pyjama,Pyjamas,Fitted,-,Plain,Standard,-,Evening,Romantic,AW24 Core,39.69,0.33323602348613146
PROD_00934,Continuity Slim Stripe Pyjama,Pyjamas,Slim,-,Stripe,Bell,-,Smart Casual,Classic,Continuity,36.35,0.30928390764814023
PROD_00935,Continuity Relaxed Floral Pyjama,Pyjamas,Relaxed,-,Floral,Sleeveless,-,Loungewear,Boho,Continuity,57.37,0.2378072102012413
PROD_00936,AW24 Core Regular Floral Pyjama,Pyjamas,Regular,-,Floral,Bell,-,Smart Casual,Classic,AW24 Core,33.74,0.31030726002716097
PROD_00937,Clearance Relaxed Polka Dot Pyjama,Pyjamas,Relaxed,-,Polka Dot,Balloon,-,Evening,Minimalist,Clearance,40.69,0.32200013334774086
PROD_00938,Clearance Relaxed Animal Print Pyjama,Pyjamas,Relaxed,-,Animal Print,Puff,-,Smart Casual,Sporty,Clearance,43.24,0.3855925189591299
PROD_00939,Clearance Regular Animal Print Pyjama,Pyjamas,Regular,-,Animal Print,Bell,-,Evening,Sporty,Clearance,36.66,0.3392839608942246
PROD_00940,SS25 Preview Oversized Animal Print Pyjama,Pyjamas,Oversized,-,Animal Print,Cap,-,Loungewear,Romantic,SS25 Preview,38.67,0.48687641807211607
PROD_00941,Continuity Relaxed Check Pyjama,Pyjamas,Relaxed,-,Check,Bell,-,Smart Casual,Classic,Continuity,37.06,0.27672333941592236
PROD_00942,SS25 Preview Relaxed Stripe Pyjama,Pyjamas,Relaxed,-,Stripe,Puff,-,Work,Contemporary,SS25 Preview,44.07,0.332168636870131
PROD_00943,SS25 Preview Slim Plain Pyjama,Pyjamas,Slim,-,Plain,Bell,-,Smart Casual,Boho,SS25 Preview,56.66,0.46431958496934517
PROD_00944,Continuity Oversized Animal Print Pyjama,Pyjamas,Oversized,-,Animal Print,Standard,-,Loungewear,Minimalist,Continuity,41.17,0.2906871875422288
